sentiment,review
positive,"a great bugs bunny cartoon from the earlier years has bugs as a performer in an window display at a local department store. after he is done for the day the manager comes in to tell him that he will be transferring soon. bugs is happy to oblige into he figures out that the new job is in taxidermy...and that taxidermy has to do with stuffing animals. animals like say, a certain rabbit. this causes a battle of wits between the rascally rabbit and his now former employer. i found this short to be delightful and definitely one of the better ones of the early s. it still remains as funny nearly years later. this animated short can be seen on disc of the looney tunes golden collection volume . my grade a"
positive,"after the usual chase scene, jerry accidentally winds up inside a bottle of invisible ink, which was part of a chemistry set. he quickly discovers he is invisible...so the predictable results occur, meaning he uses his new hidden condition to torment tom. jerry often is just defending himself, but often he has sadistic streak in him that torments the cat whenever possible, even when unprovoked. here, he makes tom think his eyes are deceiving him when cheese from a mousetrap disappears before his eyes, or milk from a dish. tom cannot take anymore so he tries to sleep this nightmare off, but jerry sets fire to his paw! man, i hope little kids did not ideas watching these cartoons back in the s and s! i always found jerry, the little mouse, more evil than cute. thankfully, in cartoons, generally, whatever damage a character suffers is gone within seconds and he is back to normal. the best part of this cartoon is about two thirds of the way through when tom figures out what the story is with jerry, and tries different methods to detect where the mouse is located such as putting flour on the floor to see his footprints ."
positive,"this is a comedy of morals, so occasionally a gentle touch of bitterness occurs, but a lightness soften all sarcasm and irony flows till all of a sudden one moment will halt your heart and changes everything. this film, marvelously written and directed, is a gem that shines perfectly, with beautiful acting by all. jean louis trintignant is exquisite as usual, and romy schneider is a pearl, perfect and glowing, that is not to be missed. a truly wonderful film !!"
positive,"the s is a great movie i saw it completely in one night about the hippy movement in the late s. although the title would suggest otherwise the first years of the s are not really important in this film. the main character of the movie is michael,a political activist who goes on the road in the us against the vietnam war. there he meets his girlfriend,sarah.michael s brother,brian,goes to vietnam to fight what a surprise! .he comes back from the war and changes in a tom cruise born on the fourth of july look a like and then into a hippy.his dad is a pro vietnam war type of guy what a surprise!! .michael s sister kate gets pregnant from a rock roll artist and runs away from home and goes to san francisco during the summer of love. the ending is very poor father becomes a liberal and everybody is happy ,but i let this slip away from my vote the rest of the movie is very good! . the performances by the actors are pretty good and the soundtrack of the movie is absolutely brilliant. all the main events of the sixties are in the movie,like the murders on jfk and martin luther king aswell as the big hippy protests,the summer of love and woodstock! look closely for wavy woodstock speaker gravy what we have in mind is breakfast in bed for . ! as a first aid employee at the woodstock festival! in the end,the s is a beautiful movie about a beautiful decade!"
positive,"mitchell leisen s fifth feature as director, and he shows his versatility by directing a musical, after his previous movies were heavy dramas. he also plays a cameo as the conductor. you can tell it is a pre code movie, and nothing like it was made in the us for quite a while afterwards like years . leisen shot the musical numbers so they were like what the audience would see no widescreen shots or from above ala busby berkeley. what i do find funny or interesting is that you never actually see the audience. as others have mentioned the leads are fairly characterless, and jack oakie and victor mclaghlan play their normal movie personas. gertrude michael however provides a bit of spark. the musical numbers are interesting and some good the rape of the rhapsody in particular is amusing but the drama unconvincing and faked three murders is too many and have minimal emotional impact on the characters. this is where this movie could have been a lot better."
positive,"i had been looking forward to how to lose friends alienate people for months, particularly due to the fact that kirsten dunst and simon pegg were starring. simon pegg is a comedic genius and kirsten dunst has always been a favorite actress of mine. how to lose friends alienate people hit the spot! of course not perfect, but very enjoyable and funny. how to lose friends alienate people follows the life of sidney young, a smalltime, bumbling, british celebrity journalist, who is hired by an upscale magazine in new york city. in spectacular fashion sidney enters high society and burns bridges with bosses, peers and superstars. after disrupting one black tie event by allowing a wild pig to run rampant, sidney catches the attention of clayton harding, editor of sharp, and accepts a job with the magazine in new york city. clayton warns sidney that he would better impress and charm everyone he can, if he wants to succeed. instead, sidney instantly insults and annoys fellow writer alison olsen kirsten dunst . he dares to target the star clients of power publicist eleanor johnson gillian anderson . he also upsets his direct boss lawrence maddox danny huston . sidney finds creative ways to annoy nearly everyone. his saving grace, a rising starlet sophie maes megan fox who develops an odd affection for him. in time, allison s friendship might be the only thing saving sydney from his downward spiraling career. the storyline is very interesting and the acting was top notch with what the actors were given. simon pegg is still hilarious as ever! he makes sydney bumbling, obnoxious, and annoying as real as it gets, but later in time making sydney not just likable, but also a real character who you root for in the end. kirsten dunst and jeff bridges were brilliant! kirsten had some very wonderful acting and hilarious scenes, and jeff bridges is just jeff f cking bridges! how can you not like him?! he makes clayton a very humorous character with some wit and overall you just love the guy. gillian anderson, megan fox, and danny huston were great as the supporting cast. each had their own personality that were overall pretty unlikable, but that is what just made the film work. one thing i did not enjoy was how one dimensional some of the characters were. i understand that most were the supporting cast, but some of the cast was underused and could have given the film some more spice to it. how to lose friends alienate people will never be on anyone s top films ever, or even top comedies ever, but it has a very high entertainment level and some scenes may even charm you as well. how to lose friends alienate people is definitely one of the better romantic comedies of the year!"
positive,"this short is a puzzlement. words fail me here, as this is almost indescribable, technically exceptional after more than years the visuals are remarkable and even occasionally amazing , this is not something you watch if you like things that are mundane or normal because it most certainly is not either. this be an odd one, gang. well worth checking out, but if things like ren and stimpy make your head hurt, you may want to skip this. recommended."
positive,"this is te cartoon that should have won instead of country cousin. visually well done and much more entertaining and memorable. worth watching just for the music alone! although there are elements that undoubtably will bruise the sensibilities of some these days, the cartoon has to be given a bit of perspective. it is over sixty years old and it is, after all, just a cartoon. i am disabled and if i were as hyper sensitive as the folks who look at things like this cartoon and take umbrage, i would have long since curled up in a fetal position and faded away. sometimes you need to lighten up, put your head back and float! caricatures of celebrities in cartoons were common in the s and s and were almost never terribly flattering. bing crosby reportedly hated it when he was used on more than one occasion. sigh"
positive,"this film seems to be well remembered as the time tom jerry signed a peace treaty. things are idyllic for a time but, predictably, it goes sour. probably the most memorable moment was the endless fight involving a pipe, a frying pan, and a baseball bat that the two plus butch the dog engage in at the beginning and end of the short. i enjoyed one a bunch and you should try to catch it on cartoon network."
positive,"this is so exciting! after i saw la roue this afternoon, a short, light hearted little movie, i consider this one a real treat! this is absolutely delightful and one of the most charming pictures i saw this year. it is the more amazing since it is an early talkie and puts some great pictures of the s to shame due to its innovative use of sound in cinema. it is simply filled with music and an adorable mood that is really upbeat and, bottom line, it made me happy! obviously it would not be so difficult to retrieve the lottery ticket the male lead was looking for, but the pace is so exhilarating and the movie is so spectacularly entertaining that i did not even think of it twice. the comedy is many times hilarious and i think it is even superior to the marx brothers, possibly the biggest comedic force of the time. this is rather perfect."
positive,"i was not sure when i heard about this coming out. i was thinking how dumb is disney getting. i was wrong. i found it to be very good. i mean it is not the lion king but it is cool to see another side from a certain point. it was very funny. also it was not one of those corny disney sequels were the animation sucks, it was just like the lion king animation. the only thing that eritated me was the whole movie theater thing through out the movie. not to give anything way but you will know what i am talking about. i also fun that it was cool to have most of the cast from the original to return. it was a very good movie over all."
positive,"tommy jones and matt dillon do the gambling world proud. the various moves with the wrists had to be learned as throwing craps is a skill in and of itself. there are a few surprises. as cynical as we are today, i fully expected the good girl to be crying over his grave, instead of his buddy s. especially with her remarks about going to the funeral of her best friend , when she first meets matt. and then of course you expect matt to kill the guy who threw battery acid in mr. allen s face, blinding him interesting role by bruce dern . wrrrooonnnnggg!!! some of the other hollywood endings do happen, but the writing is so excellent, the acting so carefully wrought that you are blissfully unaware. and the music is out of this world. taking us back to the s when our native passions were first being unleashed by the music of ray charles and bo diddley. even a little racism raring its ugly head in chicago, but at a club called, wonderfully, biloxi with a confederate flag backing up the racist remarks. i will be watching it again, just to hear the music. good thing i have the factotum sound track, so i can listen to that in the car. watch both together, and you will see how matt has matured....playing bar room characters in both. now that he owns a bar in the paramount hotel in nyc, he probably has great opportunity to do his studies. great actor, just coming into his own. he shows finely nuanced performances ...the good and the bad in his characters. his young boy off the farm is a great study, made especially poignant because of his bassett hound eyes. he makes love, convincingly as well. since he was in several movies with diane lane as a teen ager, i wonder how that it ...making love to an actress you kind of grew up with. adds conviction, i will say that."
positive,"man on fire tells a story of an ex special forces guy with a drinking problem who accepts a job as a personal bodyguard of a little girl in mexico during the wave of kidnappings for ransom. at first he is not to friendly, but then they befriend with each other, he decides to stop drinking etc., etc... then one day she gets kidnapped... and killed... and he, will not stop at anything to get the revenge. that is basically the story of man on fire but expect some big twists at least a few times including the ending which is beautiful and will probably make you cry. that is also because of the great music harry gregson williams with lisa gerrard gladiator composed. but the strongest part of the movie... wait... the thing is, everything here is perfect. first acting. denzel washington is at his best, mickey rourke and christopher walken good as always, great radtha mitchell and amazing young dakota fanning. and that is not the end of the list... then come the cinematography which is dazzling and along with superb editing, should have won an oscar for sure. the story is... not just a revenge movie. the story is intelligent, the story makes you think... and is pure beautiful. really. this is one of those movies you need to see in your lifetime, at least once!"
positive,"this movie has a great message,a impressive cast, ellen burstyn, samantha mathis, jodelle ferland was years old when she made this movie ellen burstyn and jodelle ferland have both been nominated for best actress in a tv drama at the up coming emmy awards in new york, peter masterson director has been nominated best director tv drama at the emmy awards also. april , , jodelle ferland won , best actress in a tv drama, at the young artist awards, in studio city, ca. i can see why they have nominations. mermaid is a true story, during the cridits they have the real family on the set, something you do not see often. you can find mermaid at all blockbuster video stores. do watch it,you will be glad you did."
positive,house of games has a strong story where obsession and illusion play a big part. a psychologist offers to help a patient with his gambling debts and gets caught at the game. have you ever felt fascination for something that was both dangerous and wrong? watch what happens if you pursue this urge and go all the way. sit on the edge of your chair as tricksters are being tricked and victims turn into perpetrators. you are never sure of who is exactly who in this movie. this is both a quality and a drawback of the script. as the movie ends you feel that the story lacks a bit of consistency. but all this is largely compensated by the excellent psychological development. this is definitely one of the best movies about gambling.
positive,"first off, i am not some justin timberlake fangirl obsessed with making him look good, in fact i am not even a huge justin fan, but i did like this movie. i work at a video store and when i saw this movie with its huge cast that i would never even heard of i had to see what it was about. i did not find justin s acting that bad, it was clearly the worst out of the group, but it is a pretty impressive group, with cary elwes and dylan mcdermott being two names that did not even make the first credits list. the story is basic, a journalist uncovering corrupt cops, but i found it well done. l l cool j s character was clearly conflicted, but i honestly did not know what he would do in the end. morgan freeman is as always, the wise mentor figure he does so well, and as much as i love kevin spacey, he was kind of just there. his character did not have a whole lot of substance, but it is kevin spacey, he can do no wrong. surprisingly i thought dylan mcdermott gave the best performance as a homicidal cop. truly believable and really in character, he freaked me out a couple of times. i was really expecting a lot of cheesiness to be honest. horrible catchphrases, unjustified action sequences, stuff like that, but it was surprisingly well done and i did not find any of that. every shooting had a point, it was not clich d, pretty solid really. overall, amazing cast, decent story that kept me interested and just enough action to make me jump. i do not know why it did not appear in theatres, it was better than some garbage i have seen on the big screen. i would say it is worth seeing."
positive,"a well made and imaginative production, refreshingly free from clich , this somewhat picaresque affair recounts a tale of a close friendship that develops between a man and a boy under less than ideal conditions the man an escaped convict who has kidnapped the youth for his value as a hostage. expertly directed by alan gibson with a fine sense for balanced narrative movement, the film provides freshness in nearly every scene, as felon martin steckert richard harris , believing that his rejection for parole was particularly undeserved, contrives a convoluted but ultimately successful escape plan, following which his spontaneous nature comes to the fore as he flees to the lakeside residence of his childhood. often bursting into song or dancing a few steps, the capricious steckert gradually gains the trust and affection of his captive and, as police close in for an inevitable showdown, the tethered pair are seen to be a great deal alike in their responses to forms of rejection, as discerned by a psychiatrist lindsay wagner assigned to aid a zealous police lieutenant james coburn who is in charge of the manhunt for steckert and his prisoner . this is an engrossing story, worth telling, a quickly paced and novel adventure that profits from a capital performance by harris, fine turns from wagner, coburn, and karen black, along with justin henry as the snatched lad, with an appropriately whimsical score contributed by wilfred josephs, and top notch cinematography by frank watts, with all footage shot in a beautiful autumnal ontario province."
positive,"first off, i would like to make a correction on another review of this film which said that the last musical to win the best picture academy award was gigi in . that is misinformation as west side story won in , my fair lady won in and sound of music won the year after that. that said, this film is absolutely fantastic! the story from the novel has been somewhat altered, but that is more because of the limitations that they had on a stage that they just did not change back for a filmed version. however, i do not mind. in fact, i rather think the whole production flows better than the novel does. i like nancy bringing oliver to the bridge with her and being killed there instead of later in the apartment. the subtle things in this film are the ones that make me laugh. i love the moment mr. bumble and mrs. bumble start coming out at the beginning from the governors office. the underscore for that moment is brilliant. my three favorite actors for this film were jack wild, who plays the best dodger in any film version of the story, ron moody, a playful and humorous fagin this character is worked out much better than he is in the book , and shani wallis, who is the strongest, most distressed version of nancy. the only reason i am giving this film a instead of a is because of the two big production numbers which are concider yourself and who will buy. i always hate when the choreography in musicals in meant to look like people doing everyday chores and jobs. it looks awful and cheesy, especially when they are dancing at the london meat co. they should have just done regular choreography for these scenes. however, this film is a rare treasure that will stay with us, hopefully, forever."
positive,i was never a big fan of television until i watched for the first time. i got into the series very late. season ended before i even saw my very first episode. it was an episode of series that was on my parents dvr digital video recorder box while i was house sitting for the weekend. it took that one episode for me to be hook line and sinker into the world of jack bauer. and boy was i hooked!! i watched the next six episodes without blinking an eye. the next day i went to blockbuster and signed up for an unlimited month pass for twenty something dollars and needless to say it has been the greatest blockbuster money i have ever spent. i watched the first three seasons in three weeks. that is forty minute episodes!!! i will say that finding out what happens next is easier on dvd than waiting an entire week. i can only imagine the anticipation of watching season week to week!! i find it mildly torturous and cruel but i am going to give it a try and watch it just like the rest of america!! the dvr is set and you can bet i will be chomping at the bit!!
positive,a very strange and compelling movie. it is about a very awkward and tightly wound man who attempts to navigate his life as a door to door fundraiser salesman. the director was able to capture a very unnerving tone that really served the story well. original and unsettling while also finding a great deal of humor in the pain that accompanies life. there is a sequence at a testing facility that really stood out and made me laugh out loud which is not something i do as frequently as i should. one of the more memorable films i have seen in a long while. has not left my mind and i look forward to future efforts by bronstein. fantastic performances all around. the simple line i really appreciate it. is now iconic to me.
positive,"this is certainly one of my all time fav episodes of trek. there is just so much going on in this one film that its crazy cool. first the guys beam down to an alien planet that is about to explode. they meet a freaky librarian type dude very well played . then kirk manages to get himself transported back to what is very much like th century earth. mccoy and spock try to follow but instead nearly freeze to death on the frozen version of the alien world , years in the past. kirk manages to get himself locked up and charged with witchcraft while spock enjoys some amok time with a sexy cavegirl who was vanquished to the this frozen, awful world by some bad guy. spock decides hes happy where hes at and gives mccoy a royal assestment whuppin when the doc suggests they need to look for a way out. anyhow,they all finally escape, leaving the poor cavegirl behind. it takes a ton of convincing before spock finally gives in and leaves. you can literally taste the sadness at the end. leaving the cavegirl all alone in her frozen wasteland just seems cruel and is really touching. spock must have been out of his vulkin mind to leave behind his greatest hope for love and being human. albeit, in a not so nice neighborhood! anyway, you just get so much bang for your buck with this episode....a love story, the salem witch trials, spock as a human, the desperation of being left in total isolation...abandoned, and three entirely different settings on the alien planet. its amazing they managed to jam all this into one fifty minute film. this one is a classic, do not miss it....i want it on dvd fer shure vulcans!!!!!!"
positive,"enjoyed the movie and efficient confucian crime drama, the old order survives the threat posed by a brash young greedy man, no doubt representing modern society. i thought the final scene was strange and could not understand if we were to believe that big d was being punished for being greedy or it was part of the plan a long. i loved the scene and for once in a chinese movie, the violence was not a choreographed martial arts fest. on thing that always amuses me about hk films is that the main influence the british seem to have had is to introduce yes sir and sorry into the local language and its amusing that long after we have gone, they are still there."
positive,"this movie seems on the surface to be a run of mill kids movie that parents can regretfully watch with their mostly entertained little kids. the movie seems and is mostly geared towards children yet it does not stop on this level. i watched this movie first as a young child and found it to be funny, entertaining,and heartwarming and did not see it again for several years. i watched it again recently at age and found it to be almost as funny but just as heartwarming and entertaining. this movie is highly underrated and contains many messages of real life. this movie is an inspirational quest story that is made for kids yet epic in its own right. i recommend this movie to anyone of any age."
