sentiment,review
positive,for a movie that gets no respect there sure are a lot of memorable quotes listed for this gem. imagine a movie where joe piscopo is actually funny! maureen stapleton is a scene stealer. the moroni character is an absolute scream. watch for alan the skipper hale jr. as a police sgt.
positive,"bizarre horror movie filled with famous faces but stolen by cristina raines later of tv s flamingo road as a pretty but somewhat unstable model with a gummy smile who is slated to pay for her attempted suicides by guarding the gateway to hell! the scenes with raines modeling are very well captured, the mood music is perfect, deborah raffin is charming as cristina s pal, but when raines moves into a creepy brooklyn heights brownstone inhabited by a blind priest on the top floor , things really start cooking. the neighbors, including a fantastically wicked burgess meredith and kinky couple sylvia miles beverly d angelo, are a diabolical lot, and eli wallach is great fun as a wily police detective. the movie is nearly a cross pollination of rosemary s baby and the exorcist but what a combination! based on the best seller by jeffrey konvitz, the sentinel is entertainingly spooky, full of shocks brought off well by director michael winner, who mounts a thoughtfully downbeat ending with skill. from"
positive,"a solid, if unremarkable film. matthau, as einstein, was wonderful. my favorite part, and the only thing that would make me go out of my way to see this again, was the wonderful scene with the physicists playing badmitton, i loved the sweaters and the conversation while they waited for robbins to retrieve the birdie."
positive,"it is a strange feeling to sit alone in a theater occupied by parents and their rollicking kids. i felt like instead of a movie ticket, i should have been given a nambla membership. based upon thomas rockwell s respected book, how to eat fried worms starts like any children s story moving to a new town. the new kid, fifth grader billy forrester was once popular, but has to start anew. making friends is never easy, especially when the only prospect is poindexter adam. or erica, who at feet, is a giant. further complicating things is joe the bully. his freckled face and sleeveless shirts are daunting. he antagonizes kids with the death ring a crackerjack ring that is rumored to kill you if you are punched with it. but not immediately. no, the death ring unleashes a poison that kills you in the eight grade. joe and his axis of evil welcome billy by smuggling a handful of slimy worms into his thermos. once discovered, billy plays it cool, swearing that he eats worms all the time. then he throws them at joe s face. ewww! to win them over, billy reluctantly bets that he can eat worms. fried, boiled, marinated in hot sauce, squashed and spread on a peanut butter sandwich. each meal is dubbed an exotic name like the radioactive slime delight, in which the kids finally live out their dream of microwaving a living organism. if you have ever met me, you will know that i have an uncontrollably hearty laugh. i felt like a creep erupting at a toddler whining that his dilly dick hurts. but fried worms is wonderfully disgusting. like a g rated farrelly brothers film, it is both vomitous and delightful. writer director bob dolman is also a savvy storyteller. to raise the stakes the worms must be consumed by pm. in addition billy holds a dark secret he has an ultra sensitive stomach. dolman also has a keen sense of perspective. with such accuracy, he draws on children s insecurities and tendency to exaggerate mundane dilemmas. if you were to hyperbolize this movie the way kids do their quandaries, you will see that it is essentially about war. freedom fighter and freedom hater use pubescent boys as pawns in proxy wars, only to learn a valuable lesson in unity. international leaders can learn a thing or two about global peacekeeping from fried worms. at the end of the film, i was comforted when two chaperoning mothers behind me, looked at each other with befuddlement and agreed, that was a great movie. great, now i will not have to register myself in any lawful databases."
positive,"you probably all already know this by now, but additional episodes never aired can be viewed on abc.com i have watched a lot of television over the years and this is possibly my favorite show, ever. it is a crime that this beautifully written and acted show was canceled. the actors that played laura, whit, carlos, mae, damian, anya and omg, steven caseman are all incredible and so natural in those roles. even the kids are great. wonderful show. so sad that it is gone. of course i wonder about the reasons it was canceled. there is no way i will let myself believe that ms. moynahan s pregnancy had anything to do with it. it was in the perfect time slot in this market. i have watched all the episodes again on abc.com i hope they all come out on dvd some day. thanks for reading."
positive,"i saw the movie with two grown children. although it was not as clever as shrek, i thought it was rather good. in a movie theatre surrounded by children who were on spring break, there was not a sound so i know the children all liked it. there parents also seemed engaged. the death and apparent death of characters brought about the appropriate gasps and comments. hopefully people realize this movie was made for kids. as such, it was successful although i liked it too. personally i liked the scrat!!"
positive,"you are using the imdb. you have given some hefty votes to some of your favourite films. it is something you enjoy doing. and it is all because of this. fifty seconds. one world ends, another begins. how can it not be given a ten? i wonder at those who give this a seven or an eight... exactly how could the first film ever made be better? for the record, the long, still opening shot is great showmanship, a superb innovation, perfectly suited to the situation. and the dog on the bike is a lovely touch. all this within fifty seconds. the word genius is often overused. this is genius."
positive,"this was a good film with a powerful message of love and redemption. i loved the transformation of the brother and the repercussions of the horrible disease on the family. well acted and well directed. if there were any flaws, i would have to say that the story showed the typical suburban family and their difficulties again. what about all people of all cultural backgrounds? i would love to see a movie where all of these cultures are shown like in real life. nevertheless, the film soared in terms of its values and its understanding of the how a disease can bring someone closer to his or her maker. loved the film and it brought tears to my eyes"
positive,"made after quartet was, trio continued the quality of the earlier film versions of the short stories by maugham. here the three stories are the verger, mr. know it all, and sanitorium. the first two are comic the verger is like a prolonged joke, but one with a good pay off , and the last more serious as health issues are involved . again the author introduces the film and the stories. james hayter, soon to have his signature role as samuel pickwick, is the hero in the verger. he holds this small custodial type job in a church, but the new vicar michael hordern is an intellectual snob. when he hears hayter has no schooling he fires him. hayter has saved some money, so he tells his wife kathleen harrison he fancies buying a small news and tobacco shop. he has a good eye, and his store thrives. soon he has a whole chain of stores. when his grandchild is christened by hordern, the latter is amazed to see how prosperous his ex verger. the payoff is when bank manager felix aylmer meets with hayter about diversifying his investments. i will leave it to you to hear the unintentional but ironic coda of the meeting. according to maugham he met a man like max kelada nigel patrick on a cruise. in mr. know it all kelada is a splashy, friendly, and slightly overbearing type from the middle east who is on a business trip regarding jewelry by steamship. his state room mate is mr. grey the ever quiet and proper wilfred hyde white who is somewhat, silently disapproving of max. max likes to enliven things, and soon is heavily involved in the ship s entertainment. at this point the story actually resembles part of the plot of the non maugham story and film china seas , as max makes a bet that he can tell a real piece of jewelry from a fake after insisting that a piece of jewelry he spotted is real . i will not describe the way max rises to the occasion. sanitorium is the longest segment. roland culver plays ashenden the fictional alter ego of maugham a writer and one time spy as in hitchcock s the secret agent . here he has to use a sanitorium for a couple of months for his health. he finds a remarkable crew of people, including jean simmons as a frail but beautiful young woman, finlay currie as an irascible scotsman, john laurie as a second irascible scotsman who is at war with currie, raymond huntley as a quiet patient who only shows his internal anger at his situation when his wife shows up, and michael rennie as a young man who has a serious life threatening illness. culver watches as three stories among these characters play out to their conclusions. the last, dealing with simmons and rennie, is ironic but deeply moving. it was a dandy follow up to the earlier quartet, and well worth watching."
positive,"for a mature man, to admit that he she would a tear over this film is a mature response, to a mature film. if one need admit more then perhaps one could say that, life can never be the same, after viewing such advent for it has moved us to the next level."
positive,"aileen gonsalves, my girlfriend, is in this film playing a secretary at the main character s bank. she has a lovely scene with roshan seth in a restaurant. there is more information on her website at having stated my personal interest in the film, i have to say that i think it is a beautiful movie moving, funny and beautifully filmed."
positive,"jonathan demme s directorial debut for roger corman s legendary exploitation outfit new world pictures rates highly as one of the finest chicks in chains s grindhouse classics to ever grace celluloid. beauteous russ meyer starlet eric vixen, beyond the valley of the dolls gavin gives a robust, winning performance as a brassy, resilient new fish who does her best to persevere in a grimy, hellish penitentiary. the always fabulous barbara steele offers a deliciously wicked portrayal as the mean, crippled, sexually frustrated warden her erotic dream about doing a slow, steamy striptease in front of the lady inmates is a real dilly . longtime favorite s b movie actress roberta the arousers, unholy rollers collins delivers a hilariously raunchy and endearing turn as a cheerfully forward, foul mouthed kleptomaniac felon who tells a gut busting dirty joke about pinnochio. lynda gold a.k.a. crystin sinclaire of tobe hooper s eaten alive and curtis harrington s ruby makes her lively film debut as uninhibited wildcat crazy alice. and the ever cuddly cheryl rainbeaux smith does a lovely, touching reprise of her fragile frightened innocent role from lemora a child s tale of the supernatural. although this picture does deliver the expected ample amount of coarse language, nudity, rape and violence, it is still by no means a typically crass and sexist piece of lurid mindless filth the movie very effectively explores the many ways in which men cruelly exploit women and strongly asserts the pro feminist notion that women can overcome any obstacles if they band together into a group so they can bravely face their misogynistic oppressors as one mighty fighting force. demme s zesty, confidant direction comes through with a glorious abundance of astutely observed incidental details and delightful moments of engagingly quirky human behavior. furthermore, both tak fujimoto s vibrant cinematography and john cale s marvelously dolorous oddball blues score are on the money excellent. patrick wright sheriff mack in the uproariously awful cheap rubber monster suit creature feature howler track of the moonbeast has a sidesplitting bit as a jerky cop who has his car stolen by a trio of prison escapees when he stops at a gas station to use the bathroom. lively, rousing and immensely enjoyable, caged heat qualifies as absolutely essential viewing for s drive in movie fans."
positive,"when i rented this movie to watch it, i knew that it was not going to be a mindbender movie. instead i thought of it as a disbelief of reality where someone is going to get a serious beating. and you know what it worked. kurt russel did what i though was a remarkable role in showing the emotionless soldier that he was. i recommend this movie if your out with the boys and want to watch a good action film."
positive,"it is hard to say sometimes why exactly a film is so effective. from the moment i first came across the stone boy , something told me it would be a great film. in spite of that, it seemed very unlikely that i would ever have the opportunity to actually see it for myself. then, one day, while looking through the online catalogue of my local library, i saw that they had recently purchased the dvd release of this film. which i am extremely glad for, because the cinematography is of a stunning depth and quality that an old vhs copy could never replicate. and speaking of the cinematography, i must single it out as far and above the most stunning aspect of this film. as a photographer who pursues very nearly the exact visual style portrayed in the stone boy , i am a firm believer in the fact that a great cinematographer can almost single handedly carry a film. here, he has a lot of help from an extremely talented cast, and a director who understands perfectly what the story needs. but to have juan ruiz anch a behind the camera makes virtually every scene something of beauty. and you can almost never say that. most films would never even expect such a thing of you. scene after scene captures some detail, some little bit of visual magic that takes your breath away. the director, christopher cain, has had a long and interesting career. as far as i can gather, this film is not very representative of it. but, sometimes, to catch a director near the beginnings of his career, before all the big budgets and loss of focus, there is a real subtle magic to be found. cain steps back in this film, let us things happen with a life of their own, and then ever further. much like early john sayles films, characters are given space to breathe, time to talk. side stories happen because they do, and that is how life is. cain displays a remarkable, raw, even outright painful understanding of human nature in this film. the acting ties much of this story together. when people talk, when they exist in this film, they do so as actual people, not held back by the fact that they are playing characters. gina berriault s script allows immensely talented and respected actors like wilford brimley, robert duvall, glenn close, and frederic forrest to spend time simply existing. whether the things they have to say are minor or of deep significance, it all comes down with the weight of pure reality. when you look at the actors involved, or the great soundtrack by james horner, it seems strange that such a film be very nearly forgotten. maybe much of what makes the stone boy what it is was the time period it was made in. there is this s hangover feeling to this picture that reminds me deeply of my own childhood. people talk of the s in terms of modern styles and music, but that is not the s i lived in or remember. the look of the images, the understated and dark knowing quality of the acting, and the overall result should get under the skin of any person who grew up in or near this era of time in north america. i see myself in this. i see how i saw the world. and a film like the stone boy sees the world for how it truly is. for more of this feeling, please see the black stallion , never cry wolf , tender mercies , testament , places in the heart , matewan , high tide , driving miss daisy , the secret garden , the secret of roan inish , wendy and lucy"
positive,"yes, this gets the full ten stars. it is plain as day that this fill is genius. the universe sent trent harris a young, wonderfully strange man one day and harris caught him on tape, in all that true misfit glory that you just cannot fake. too bad it ended in tragedy for the young man, if only an alternate ending could be written for that fellow s story. the other two steps in the trilogy do retell the story, with sean penn and crispin glover in the roles of the young men, respectively. the world is expanded upon and the strangeness is contextualized by the retelling, giving us a broader glimpse into growing up weird in vanilla america. recommended for anyone and everyone!"
positive,hello. this movie is.......well.......okay. just kidding! its awesome! it is not a block buster smash hit. it is not meant to be. but its a big hit in my world. and my sisters. we are rockin rollers. go ramones!!!! this is a great movie.............. for me!
positive,"this is a film that was very well done. i had heard mixed reviews while it was in production and have been waiting for its release! cheers to the director and all the actors. the supporting cast gave eva mendez what she needed to take this to the top. as everyone else here states, the latter portion of the film is riveting. katie cassidy did an amazing job with her character, being she had not done a lot of work when this film was made. she has quite the career ahead of her. i was amazed at her performance. i completely enjoyed the film, questioned my values in life and priorities, and am a better person for it! a great message lies within the film. release it so all can enjoy!"
positive,"a typical romp through cheech and chong s reality which includes drugs, singing, more drugs, cars and driving, even more drugs, pee wee, aliens, gasoline, laundry, stand up comedy, surprisingly more drugs and space coke !!. it is not as coherent or plausible as up in smoke but it still is incredibly funny, without becoming as strange as nice dreams. there are some classic scenes, which include the opening scene where they get some gas for their car and the drive to work. also funny is cheech s song mexican americans and chong s follow up song. another notable scene is the welfare office scene with jones human noise machine , from the police academy series, and the old laughing man. all in all, this is a great follow up to up in smoke and is quite watchable when sober or not. celluloid rehab"
positive,ok here is what i say the movie was excellent. i am a huge nancy fan and i have read all original books and i went on to read more. i am now on . beware of villains giving this movie a lower grade than it should have. all clues point to a wonderful movie! i loved the whole thing. so what nancy is in current time. she is still old fashioned like she is in the books! people who have not read more than books are complaining about the view of nancy. i have read all of them and i think emma is perfect and that nancy was perfect. i found parts of the movie spooky. i loved the exciting car chases and get aways. i loved the clues. i solved the mystery myself! it was really wonderful. i suggest you go see it since people who have been complaining know nothing of a what a good movie is and b about nancy drew. go see it. it may not be oscar worthy but its really a good movie.
positive,"this is one of the first films i can remember, or maybe the first one. exactly the beautiful kind of film than introduce a kid, sweetly, into the world of violence and addictions were we live. a little bit of babe, casino and constantine, all this well mixed into a carton, and we get this. i do not know if its truly rated for kids, but i think it was very cool, very funny and interesting. i hate when a film spescially a carton can have a good end and its ruining because every character must have a happy end, even if it sounds weird i am not a bitter person .but this was ok, he simply goes heaven and they let it in that way. all this is just a critic, its a good movie an something new. very touching and i got to go"
positive,"this film is worth seeing alone for jared harris outstanding portrayal of john lennon. it does not matter that harris does not exactly resemble lennon his mannerisms, expressions, posture, accent and attitude are pure lennon. best scene lennon in a local cafe verbally sparring with a stuttering fan as to whether paul mccartney wings silly love songs is worthy of status in america."
positive,"i was years old when this show was on tv. by far it was my favorite. the actors were very credible. alexandra bastedo was just gorgeous.... i just order the dvd episodes . they did not have super powers. they just had superior human skills strength, hearing, sight . the actors were very good in their rolls, very believable. there was a good story in each episode. at the time, there were no special effects or explosions everywhere, so the script was suppose to be good, and the characters performs were great. there was no fancy stuff, like in other shows. they did not try to make a joke every minutes to make a light show. i highly recommend this tv show to anybody that like good stuff."
positive,"here is another movie that should be loaded into a satellite, fired into space and pointed in the direction of the galaxy andromeda to show distant possible civilizations the best of humanity. this movie is so endearingly stupid and revealingly honest in being little more than a rip off of the already bad movie classic king kong from that it not only manages to upstage that film in terms of sheer belly laugh idiotic goofiness, but successfully predicted much of peter jackson s miserable computer cartoon bearing the same name, as far as a romance between the giant here a yeti and a gorgeous human female antonellina interlenghi of umberto lenzi s city of the living dead, who is very easy on the eyes . the film was made for kids so aside from some innuendo over fish bones and a bizarre nipple tweak to say goodbye you can forget about sex the yeti even has a sort of giant jock strap to cover up his monstrous package, the result being even more amusing than anatomical correctness. but as a trade off you do get a wacky old scientist, two inquisitive kids, tony kendall in a rare turn as a duplicitous bastard of a villain, a helpful intelligent collie dog who gets to have her own adventure dog adventure movies were big in europe for a while and of course emerges as the hero at the end for saving the yeti, who turns out to be the good guy, glorious stuff like front end loaders decorated to look like giant ape hands, a monster who is size literally changes scale from shot to shot, some inappropriately horrible deaths that will make the carnage in godzilla vs the smog monster look tame by comparison, crowd reaction shots a plenty made up of either spanish, italian or canadian extras depending upon scene you can sort of tell where they were shooting from how the extras are dressed , and some of the most enthusiastically staged but inept special effects work ever in a giant monkey movie. it is here that the film won me over it is enthusiasm just for being made. frank kramer is actually the same gianfranco parolini who brought the world sartana in and god s gun the year before this was a very important director in the spaghetti western and action adventure genre film scene from the s s and by the time of yeti he was probably delighted to get the work. i would say that this is his most adventuresome movie ever, or rather the one he took the most chances with, and may have felt more comfortable taking those chances with the film aimed at kids families. the movie has a kind of reckless abandon to the way it was made that renders the technical errors or inconsistencies totally meaningless. or rather they are part of the fun, and if the movie had been played seriously it would not have worked which is exactly why peter jackson s movie sucked. he forgot to have fun with the material and let it dictate the outcome using his army of stupid power macintosh pod people animators, and with all it is faults clunkiness, kramer s yeti is actually closer to the spirit of why we watch movies like this, which is partly to see actors in ape suits tearing apart miniature sets on sound stages, not seamlessly animated vapid hours of nothing other than hard drive space. i would rank this up there with king kong versus godzilla and it! curse of the great golem as one of the most enjoyably improbable giant rampaging monster movies ever. because the movie looks so fake you can get over the story and just have fun watching stuff get wrecked, trampled, tossed about and smashed. knowing that and armed with a fertile, energetic enthusiasm for having the chance to make the movie, parolini pulled out all the stops and delivers a full bodied adventure that might get a bit rough for some of the small tykes but is the first movie i will ever share with the grandkids someday when their stupid parents leave them with me for a weekend. this is stuff for the ages and one of the most telling expressions of humanity to ever be committed to celluloid. , it is about ten minutes too long but who cares, you only come around once and i would rather go out with a smile on my face."
