sentiment,review
positive,"to all the reviewers on this page, i would have to say this movie is worth seeing. so it was made in , so what. the fashion in the movie was exactly the same fashion of its time. people who did not study culture of the decades would think that this movie is a cheese ball. compared to the modern series, left behind, which is made for our time right now it does look cheezy. however, the only cheezy part of the movie is the fashion, which again was over years in the past. but. the message that is sent in this film is very powerful, and carefully preserved. there is just so much to say, but i refuse to say it. for fear of spoiling it so go out and see this film! if you do not like the message that it sends, then you have issues, that need some attention!"
positive,"a favourite of mine,this movie tells of two feuding new york characters , steve brodie raft and chuck connors beery ,who both strive to be the main guy in the bowery in the late nineteenth century. brodie and connors ,were real people,though this is a heavily fictionalized account of their antics based on a play .brodie s legendary did he do it? it is still a because of argument! ,jump from the brooklyn bridge ,for which he became famous,is shown here as happening around the same time as the spanish american war .director walsh clearly had a great affection for the period,so beautifully recreated here,and it includes a wild rumbustious ragtime number from saloon singer trixie odbray a young pert kelton .raft is at his slickest as brodie,and beery shows again what a clever actor he was,as tough, big hearted, and at times quite touching connors.pretty fay wray is the love interest both the boys are pursuing. full of life and energy, the bowery moves at a fast pace unlike many early talkies .it is not an easy movie to find,but is well worth looking out for."
positive,as most off you might off seen star wars return off the jedi you may knows its a good movie but as you might have seen on video they m might have a party at the end and they just probably end the movie with the party with no a spirits or anything but on the original one live tv when they are partying but before i say more when ben obi wan dies in the imperial ship or death star they saw him disappear and yoda dies from either old age or internal illness but because luke killed darth vader real name anakin skywalker when they all are partying at the end when luke or someone stops the spirits off ben and yoda stands starring at him and smiling while another spirit appears is its darth vader but not as a sith as the old usual selve off him and started smiling with ben and yoda i reckon that made the movie ending a little bit interesting but the producers or anyone should off made a spirit off padme and mace windu and other jedis that got killed with younglings under there arms in the back ground
positive,"i thought this movie was lol funny. it is a fun, not to be taken seriously, movie about one man s twisted views on life, love, and... well, ladies from the lowly bus station skank, to the high class d butante... bus station skank. tim meadows plays a guy leon phelps who was raised by in a playboy style mansion by a hugh hefner esquire father figure, surrounded constantly by beautiful porn models and actresses. when his father kicks him out on the street he must learn to fend for himself with nothing but the chauvinistic outlook on life that his youth has taught him... that and an unfathomable, nearly mystical level of charm and dumb luck. and so the hijinx begin! if you have not seen this movie and you enjoy a light hearted, semi mindless, comedy love story, then i highly recommend renting the ladies man ."
positive,"hood of the living dead had a lot to live up to even before the opening credits began. first, any play on ...of the living dead invokes his holiness mr. romero and instantly sets up a high standard to which many movies cannot afford to aspire. and second, my movie watching companion professed doubt that any urban horror film would surpass the seminal leprechaun in the hood. skeptical, we settled in to watch. we were rewarded with a surprisingly sincere and good hearted zombie film. oh, certainly the budget is low, and of course the directors amateurs friends populate the cast, but hood of the living dead loves zombie cinema. cheap? yeah. but when it is this cheap, you can clearly see where love holds it together. ricky works in a lab during the day and as a surrogate parent to his younger brother at night. he dreams of moving out of oakland. before this planned escape, however, his brother is shot to death in a drive by. ricky s keen scientific mind presents an option superior to cpr or injections of his lab s experimental regenerative formula. sadly, little bro wakes up in an ambulance as a bloodthirsty oakland zombie! chaos and mayhem! i think it is more economical to eat your enemies than take vengeance in a drive by, but then again, i am a poor judge of the complexities of urban life. how poor a judge? in response to a gory scene involving four men, i opined ah ha! white t shirts on everyone so the blood shows up. economical! i used the same technique in my own low budget horror film. jordan replied, no, that is gang dress. white t shirts were banned from new orleans bars for a time as a result. oh. a lot of the movie is set in someone is living room, so there is a great deal of hanging out and waiting for the zombies. but the characters are sympathetic and the movie is sincere it surpasses its budget in spirit. zombie explanation when man plays god, zombies arise! or, perhaps follow fda approved testing rules before human experimentation! contribution to the zombie canon this is the first zombie movie i have seen with a drive by shooting. as far as the actual zombies go, infection is spread with a bite as usual, but quite unusually head shots do not work it is heart shots that kill. zombies have pulses, the absence of which proves true death. and these zombies make pretty cool jaguar growl noises. gratuitous zombie movie in joke a mercenary named romero. groan. favorite zombie jaguar noise little brother zombie, of course!"
positive,"pierce brosnan the newest but no longer james bond, is an assassin. he is very very good at what he does, but he is getting old and tired. greg kinnair is really good as the straight and narrow business man. now when the story opens the movie shows these two people in their separate lives. then one night they are having drinks in a bar, and they begin to talk. then all of a sudden you find these two people getting drawn together during a series of events. the story is excellent, the acting is top notch, and the humor is hilarious i never thought that pierce brosnan would be this funny, but he really is and i must say this movie is a must see."
positive,"this is one of those film s pilot that if you knew battlestar galactica it helps, but is not necessary. what makes this even more believable of a story than bsg is that this is not something so far away in the future. this has such a depth to it that it is quite astonishing it was not released theatrically. the leads could not have been chosen better in such experienced quite talented actors. eric stoltz is superb as the father who will do anything to be re united w his daughter however real or not she is he will do it no matter the cost. paula malcomson of deadwood fame is terrific as his wife as well. you are not sure completely of his motives whether it is love or money or both, but that is what makes this pilot even more intriguing. i see a star in the making of zoe played by the relative unknown alessandra torresani her performance. esai morales is terrific in his desire to see his loved one again just how wrong to be even considering what he wants more than his moral objections. i did not think this would be a good idea when it was announced but from the pilot alone i am thrilled to see how we got to the bsg stage story. it is great to see adama as a child already being affected influenced by the different sorts of robots starting to permeate life at this stage. i just hope that they can keep up the stories so we can figure out even more how they got the the humanoid typed robots. this is an almost perfect pilot i hope they can keep up the fantastic storytelling. even the visual effects are better than most of the garbage you see on the big screen. if you have not gotten into bsg, least try this i will bet you become a fan will want to see how the bsg story came to be."
positive,"this could not have been better. the strong restraints on mike sullivan s expressions could not have been portrayed in any other way. tom hanks delivers the best performance of his career. young tyler hoechlin drives an emotional wheel playing the basis character for the story. and veteran paul newman gives one of his best character performances in a long time. this film is based on a bold graphic novel by max allan collins and richard piers rayner. this is a father son story which basically employs the two candidates solely unfit for the roles. mike sullivan had no father as a child, so john rooney took him in. although a generous man, mr. rooney involved himself in organized crime. therefore, the debt of sullivan was only to be paid off in involving himself in the business. now, sullivan has a wife and two children and is trying to keep his children safe, but at the same time pay back his boss. the events to follow, will test sullivan s loyalty and embrace his family s fate. with a great adaptation by david self, the dialogue comes out seldomly, but yet very virtuous. the story unfolds in a beautiful s setting brilliant art direction by richard l. johnson nancy haigh covered with a dark rainy snow on the ground exterior. driving the story, is thomas newman s wonderful irish score, settling in only when necessary. but the most important technical element in the film is conrad l. hall s beautiful photography. this is some of the best cinematography i have seen and i watch a lot of films. the scene when mike and michael are in the car, entering chicago is quite impressive. the shot starts at the front of the car, revealing mike hanks through the windshield. it subsequently dollys around to the side of the car, to see michael hoechlin awakening and peering out his side window. as it continues, it trucks sideways and dollys back, completely around the car and reveals a gorgeous scenic s chicago. with a great cast and crew, the principle man creates a brazenly amazing film. i am talking about sam mendes, who made his feature film debut in with american beauty. won him various awards before american beauty, mendes worked as a play director for the british theater, but decided that he wanted to move on saying that there was nothing new for him in theater. with only two films, sam mendes has marked himself in my book as one of the great directors in a list of about twenty five . the film illuminates a brazen genre that has its hits and misses and expresses the true theme brilliantly. the photography, acting and story is phenominal. i am still waiting for scorcesee s gangs of new york, but for now, i am fully confident in saying that this is the best film of the year . considering it is competition signs, insomnia, minority report that is a strong statement."
positive,"i was probably one of the few australians not watching the tennis when this series aired. i have to say when william mcinnes first appeared i though, that is one crappy actor! but as the series continued he toned down his performance and i totally loved him. he was such a rotten guy but he did make me laugh. i watched the show to see hugo speers heart and bones, the full monty and tom long seachange, two hands . it was interesting to see speers play a nice, quiet man and even more interesting to watch tom longs rippling muscles! sigh... seriously, long s performance was a total shock and really brilliant. he stole the show. martin sacks was good also in a small role, and the leading actress put in an entertaining performance. i would recommend this programme if you enjoy stories with a twist and watching tom long walk around with no shirt on..."
positive,"my evaluation i like a lot this movie. compare to today brainless movie just action and special effet and nothing new about ideas , soylent green ask to something that today does not exist anymore to think. well it would not a big surprise a day human eat cookies which are create with body of human. with all what happen on this planet, and to see how people are so indifferent to all, this kind of future is possible. sure this movie take some age but the idea behind the movie is actual again. rich at paradise, other in the hell. well a luck today they are tv and idiocy like reality show . tv is a good wash brain. it is pity to see that intelligence of human have not progress like technologies. since writing all stop. if you like reality show this movie is not for you. if you believe all politician same too. if you do not like ask yourself question about now and future well never look this movie."
positive,"james stewart stars in a classic western tale of revenge which ties in with the fate of the films other star the winchester rifle. stewart is it goes without saying excellent adding some cold hard obsession to his usual laid back cowboy. the story follows the fate of a winchester rifle and its owners after being won in a competition by our hero and stolen by the man he is hunting. we meet a selection of gamblers, gun fighters, indian traders and bank robers as we follow the rifles path through indian battles, bank heists etc. the supporting cast are all solid with dan durya standing out as waco johnny dean the live wire gunfighter with an itchy trigger finger. also as a trivia note a very early appearance from rock hudson as an indian chief. the end showdown is a classic a tense rifle battle fought at long range in and around a rocky outcrop. throw in some good old western action, fist fights, shootouts and horseback chases it makes for a rollicking western adventure."
positive,"this movie did not really surprise me, as such, it just got better and better. i thought paul rieser wrote this, huh? well...we will see how he does... then i saw peter falk was in it. i appreciate colombo. even though i was never a big fan of the show, i have always liked watching peter falk. the performances of peter and paul were so natural that i felt like a fly on the wall. they played off of each other so well that i practically felt giddy with enjoyment! ...and i had not even been drinking! this movie was so well done that i wanted to get right on the phone to paul and let him know how much i enjoyed it! but i could not find his number. must be unlisted or something. this was one of those movies that i had no idea what it was going to be about or who was in it or anything. it just came on and i thought eh, why not? let us see. if i do not like it i do not have to watch it... ...and i ended up just loving it!"
positive,"one of the most nihilistic and brutal films i have ever seen, but also one of the most tragic and moving ones. this is an action melodrama like the world has never seen it before. sometimes the plot got me close to tears, while in the next moment delivering shocking revelations like a bone crunching blow to the guts. chilling performance by edison chen. the story of a hk cop and a cambodian killer hunting each other down, while bit by bit losing their humanity, is a strong one. featuring very little dialog in favor of haunting imagery and gritty camera work, dog bite dog is pure hk bloodshed without the heroism."
positive,"this is an excellent film for female body builder female action fans! i think that sue price did a great job in this film series nemesis , , and proved to be a great fighter. she has a very striking appearance and a will of iron to resist the powerful nebula nemesis . though not a film of great value and sue price s acting skills not the best to have met in my life, the movie itself was something awesome, a priceless gem for fans of female body builder action! well, some parts of nemesis have been copied by other famous sci fi films, such as terminator or predator, but that is not the point. the point is that a.puyn casted in that film a very talented body builder who put all of her energy and body talent to show us the best she can do. i really enjoyed that film and watched with the same enthusiasm nemesis a rather boring sequel and nemesis a much more interesting sequel than . what a pity it has not shown yet on dvd"
positive,"this is a great movie that i do not think gets enough credit as saturday night fever or grease in john travolta s career. he plays a man who is in love with a girl but is too pig headed to admit his feelings to her. instead, he wants to engage in mechanical bull riding because he thinks it will show his manhood. even though it was made in , it is still timely today. the great country music soundtrack is terrific."
positive,"one of the best love stories i have ever seen. it is a bit like watching a train wreck in slow motion, but lovely nonetheless... big edie and little edie seem a bit like family members after watching this movie repeatedly, and are infinitely quotable it is a goddamned beautiful day, now will you just shut up? the opening explanation of little edie s costume only promises that the movie will live on forever, and so will big edie the world famous singer and little edie the world famous dancer."
positive,"thanks should be given to the hong kong vcd dvd distributors that i only paid us . and i could have such a surprisingly delightful enjoyment. adultery? how common in our modern days. eva grabbed her two children and kidnapped nick to chase after luis and charlotte to italy. she wants her revenge done but at the end, she also commits the same crime of luis she had sex with nick. in this small indie production, vivian naefe dealt with the teething problems in modern marriage with a light heart. how can one dare treat marriage seriously in this fast food time where people are now of higher mobility in physical, mental and technology areas? conjugal commitment asks for too high a price that most people would choose to succumb to circumstances. nick once trusted charlotte but he fell for eva after that kidnap journey which forced him to experience much growth. most viewers may feel happy about the ending because eva and nick come together, well, this should be the greatest retribution to the unfaithful act of their spouses. however, i want a sequel, i want to see how the four would develop after this exchange. perhaps they may exchange back, how can one be so sure about the shaky love relationship. good acting and good scenery. the two little child actors should not be neglected especially the boy when he cries at the reception of the hotel in venezia. and of course, how can we forget the bella, bella scenery of the city."
positive,"mesmerizing, breathtaking and horrifying, this hauntingly beautiful film is the apocalypse now without fiction. slow in pace, quiet in mood, it gives good glimpses of the poisoned patches of earth that may well be signs of an inevitable doom. there is no doubt in my mind the nature is plagued and we are the disease. greed, the very essence of humanity that drives evolution and progress, has turned us into something like cancer, on its way to consume the host and die with it... manufactured landscapes is quite an unforgettable viewing experience at least i will never regard my toaster and iron the same way again."
positive,"i have to say that this miniseries was the best interpretation of the beloved novel jane eyre . both dalton and clarke are very believable as rochester and jane. i have seen other versions, but none compare to this one. the best one for me. i could never imagine anyone else playing these characters ever again. the last time i saw this one was in when i was only . at that time, i was a bookworm and i had just read charlotte bronte s novel. i was completely enchanted by this miniseries and i remember not missing any of the episodes. i would like to see it again because it is so good."
positive,"at first glance, it would seem natural to compare where the sidewalk ends with laura. both have noirish qualities, both were directed by otto preminger, and both star dana andrews and gene tierney. but that is where most of the comparisons end. laura dealt with posh, sophisticated people with means who just happen to find themselves mixed up in a murder. where the sidewalk ends is set in a completely different strata. these are people with barely two nickels to rub together who are more accustomed to seeing the underbelly of society than going to fancy dress parties. where the sidewalk ends is a gritty film filled with desperate people who solve their problems with their fists or some other weapon. small time hoods are a dime a dozen and cops routinely beat confessions out of the crooks. getting caught up in a murder investigation seems as natural as breathing. while i have not seen his entire body of work, based on what i have seen, dana andrews gives one of his best performances as the beat down cop, det. sgt. mark dixon. he is the kind of cop who is used to roughing up the local hoods if it gets him information or a confession. one night, he goes too far and accidentally kills a man. he does his best to cover it up. but things get complicated when he falls for the dead man s wife, morgan taylor tierney , whose father becomes suspect number one in the murder case. as morgan s father means the world to her, dixon s got to do what he can to clear the old man without implicating himself. technically, where the sidewalk ends is outstanding. besides the terrific performance from andrews, the movie features the always delightful tierney. she has a quality that can make even the bleakest of moments seem brighter. the rest of the cast is just as solid with tom tully as the wrongly accused father being a real standout. beyond the acting, the direction, sets, lighting, and cinematography are all top notch. overall, it is an amazingly well made film. if i have one complaint and admittedly it is a very, very minor quibble it is that tierney is almost too perfect for the role and her surroundings. it is a little difficult to believe that a woman like that could find herself mixed up with some of these unsavory characters. it is not really her fault, it is just the way tierney comes across. she seems a little too beautiful, polished, and delicate for the part. but, her gentle, kind, trusting nature add a sense of needed realism to her portrayal."
positive,"castle of blood aka castle of terror is a well crafted, surprisingly spooky entry from italian director anthony dawson. exquisite black and white cinematography, flawless dubbing, superb casting, fairly logical scripting, deliberate pacing and a surprise though totally appropriate ending set this one apart. only the films sometimes hokey music and the rather abrupt love at first sight between elizabeth barbara steele and alan georges rivi re mar an otherwise surprisingly entertaining movie. while visiting england, edgar allan poe sits in a pub, telling one of his ghostly stories to count blackwood. recognizing the great writer, alan, a young news reporter, requests an interview with poe. during the course of the conversation, poe reveals that all of his stories are true. incredulous, alan expresses his skepticism about life after death. count blackwood offers to bet alan pounds that he cannot survive this night in blackwood s castle, a night following halloween when the dead walk. alan cannot afford the bet, so he bets his life for a pound wager. unlike mario bava s overpraised black sunday, aka the mask of satan , castle of blood is fairly restrained, making the few moments of violence even more dreadful, especially surprising from a director usually associated with those terrible italian space movies from the s. it is a pity the only version of this film i have found is badly deteriorated and recorded pan and scan version. even so, it is well worth seeing, and cries out for a modern remake, perhaps with christina ricci or jennifer love hewitt in the role of elizabeth. watch it and enjoy a film that compares well with robert wise s the haunting ."
positive,"cuban blood is one of those sleeper films that has a lot to say about life in a very traditional way. i actually watched it while sailing around cuba on a western caribbean cruise. it details the life of an year old boy in a small town in cuba in and during the revolution. not much time is spent on the revolution until the very end, when the socialist regime came and took the property of the boy s father. the majority of the film is the boy s coming of age and the relationships that arise in a small town where everyone knows everyone else. there are some powerful scenes that everyone can relate to. a class a film with fine acting and directing. this is a film that tells a story with no special effects or grand schemes or real twists. it is a film about people and their lives, their mistakes, and their triumphs. a good film worth watching several times annually."
